{
  "$schema": "./evidence-packets.schema.json",
  "jurisdiction_id": "state-va",
  "state_abbr": "VA",
  "reviewed_at": "2026-04-04T18:30:00.000Z",
  "investigation_reason": ["source_conflict", "coverage_gap"],
  "summary": "Virginia has stronger statewide AI-in-education evidence than the current record showed. VDOE's Technology in Education page documents statewide generative-AI teacher training, a Year of Learning leadership initiative, and an AI Advisory Committee, while the Virginia Board of Education's technology plan directs guidance for integrating AI with expectations for academic integrity.",
  "candidate_sources": [
    {
      "title": "Technology in Education | Virginia Department of Education",
      "url": "https://www.doe.virginia.gov/programs-services/school-operations-support-services/technology-in-education",
      "authority_level": "official_guidance",
      "source_type": "department_guidance_page",
      "selected": true,
      "why_it_matters": "This official VDOE page documents statewide teacher training, leadership support, and AI governance activity."
    },
    {
      "title": "Virginia Education Technology Plan 2024-2030 | Virginia Board of Education",
      "url": "https://www.doe.virginia.gov/home/showpublisheddocument/51991/638406435372930000",
      "authority_level": "official_model_policy",
      "source_type": "board_adopted_plan",
      "selected": true,
      "why_it_matters": "This statewide plan explicitly calls for guidance that allows AI integration and sets expectations for academic integrity."
    },
    {
      "title": "Digital Learning Integration Standards of Learning | Virginia Department of Education",
      "url": "https://www.doe.virginia.gov/teaching-learning-assessment/k-12-standards-instruction/digital-learning-integration-standards-of-learning",
      "authority_level": "official_guidance",
      "source_type": "standards_context",
      "selected": false,
      "why_it_matters": "This provides standards context but not the clearest field-level AI evidence compared with the two selected sources."
    }
  ],
  "field_level_findings": {
    "ai_use_allowed": {
      "value": 2,
      "rationale": "Virginia has statewide guidance aimed at allowing AI integration with guardrails around academic integrity rather than a blanket prohibition or unrestricted use.",
      "evidence_quote": "Develop and recommend guidance that allows for the integration of artificial intelligence and holds expectations for academic integrity.",
      "source_url": "https://www.doe.virginia.gov/home/showpublisheddocument/51991/638406435372930000"
    },
    "assessment_policy": {
      "value": 0,
      "rationale": "The reviewed statewide sources did not provide sufficiently explicit AI-specific assessment or disclosure rules to support positive coding."
    },
    "privacy_policy": {
      "value": 0,
      "rationale": "The reviewed statewide sources did not include direct AI-specific student-data privacy or procurement controls."
    },
    "teacher_pd_support": {
      "value": 3,
      "rationale": "Virginia is actively backing statewide educator support through workshops and a leadership initiative focused on generative AI integration.",
      "evidence_quote": "The Virginia Department of Education (VDOE) provided Generative AI teacher training in the fall of 2024... these workshops enrolled 360 educators.",
      "source_url": "https://www.doe.virginia.gov/programs-services/school-operations-support-services/technology-in-education"
    },
    "implementation_stage": {
      "value": 3,
      "rationale": "Virginia has moved beyond exploration into active guidance and implementation support through statewide workshops, an AI Advisory Committee, and leadership programming.",
      "evidence_quote": "The VDOE’s AI Advisory Committee provides strategic recommendations, elevates concerns about AI integration, and advises on effectively integrating AI while supporting innovation and responsible digital practices.",
      "source_url": "https://www.doe.virginia.gov/programs-services/school-operations-support-services/technology-in-education"
    }
  },
  "conflicts_found": [],
  "open_questions": [
    "If Virginia later publishes formal privacy or procurement guidance tied directly to AI systems, privacy coding should be revisited.",
    "Assessment-specific AI guidance may exist in separate superintendent memos or local policy resources and should be monitored."
  ],
  "approval_recommendation": {
    "approval_route": "sample_audit",
    "confidence": 0.88,
    "rationale": "Virginia now has strong official evidence for AI use guidance, educator support, and active implementation, but the evidence is still stronger on training and governance than on assessment/privacy, making sample audit the right route."
  },
  "recommended_record": {
    "review_status": "approved",
    "extraction_status": "validated",
    "coder_type": "hybrid",
    "confidence": 0.88,
    "policy_strength": 8,
    "ai_use_allowed": 2,
    "assessment_policy": 0,
    "privacy_policy": 0,
    "teacher_pd_support": 3,
    "implementation_stage": 3,
    "policy_orientation": "capacity-building",
    "notes": "Deep-research review found stronger official statewide evidence for Virginia than the prior placeholder record. VDOE and Board of Education materials support guided AI integration, statewide educator training, and active implementation support.",
    "verification_status": "supported",
    "verification_notes": "Official Virginia sources support moderate AI-use guidance and strong teacher-support / implementation coding. Assessment and privacy remain uncoded because the reviewed sources are not explicit on those domains.",
    "policy_domains": ["ai_use", "teacher_pd", "governance"],
    "source_documents": [
      {
        "url": "https://www.doe.virginia.gov/programs-services/school-operations-support-services/technology-in-education",
        "title": "Technology in Education | Virginia Department of Education",
        "raw_file": null,
        "published_date_guess": "2026"
      },
      {
        "url": "https://www.doe.virginia.gov/home/showpublisheddocument/51991/638406435372930000",
        "title": "Virginia Education Technology Plan 2024-2030 | Virginia Board of Education",
        "raw_file": null,
        "published_date_guess": "2024"
      }
    ],
    "evidence_spans": [
      {
        "field": "ai_use_allowed",
        "quote": "Develop and recommend guidance that allows for the integration of artificial intelligence and holds expectations for academic integrity.",
        "source_url": "https://www.doe.virginia.gov/home/showpublisheddocument/51991/638406435372930000",
        "chunk_id": null
      },
      {
        "field": "teacher_pd_support",
        "quote": "The Virginia Department of Education (VDOE) provided Generative AI teacher training in the fall of 2024... these workshops enrolled 360 educators.",
        "source_url": "https://www.doe.virginia.gov/programs-services/school-operations-support-services/technology-in-education",
        "chunk_id": null
      },
      {
        "field": "implementation_stage",
        "quote": "The VDOE’s AI Advisory Committee provides strategic recommendations, elevates concerns about AI integration, and advises on effectively integrating AI while supporting innovation and responsible digital practices.",
        "source_url": "https://www.doe.virginia.gov/programs-services/school-operations-support-services/technology-in-education",
        "chunk_id": null
      }
    ]
  },
  "gold_record": {
    "jurisdiction_id": "state-va",
    "state_abbr": "VA",
    "ai_use_allowed": 2,
    "assessment_policy": 0,
    "privacy_policy": 0,
    "teacher_pd_support": 3,
    "implementation_stage": 3,
    "policy_domains": ["ai_use", "teacher_pd", "governance"],
    "approval_route": "sample_audit",
    "required_evidence_fields": ["ai_use_allowed", "teacher_pd_support", "implementation_stage"],
    "source_packet": "data/generated/deep-research/va.evidence-packet.json",
    "review_confidence": 0.88,
    "evidence_urls": [
      "https://www.doe.virginia.gov/programs-services/school-operations-support-services/technology-in-education",
      "https://www.doe.virginia.gov/home/showpublisheddocument/51991/638406435372930000"
    ],
    "notes": "Deep-research-reviewed hard case. Official Virginia sources support guided AI integration and strong statewide educator-support activity."
  }
}
